{
  "schema_version": 1,
  "trial_id": "bc6ad94f-19f8-480e-978f-e80dc90d938b",
  "candidate": {
    "skill_name": "conditional-customer-success",
    "skill_path": "conditional-customer-success",
    "tree_hash": "39ede540f58ad8d0"
  },
  "case": {
    "case_id": "conflicting-health-evidence-decision-path",
    "prompt_hash": "32696e2c832fd622",
    "fixture_hashes": {}
  },
  "adapter": {
    "name": "fake",
    "version": "0.1.0"
  },
  "harness": {
    "name": "fake",
    "version": "0.1.0"
  },
  "model": {
    "provider": "unspecified",
    "model_id": "unspecified"
  },
  "permissions": {},
  "network_policy": "unspecified",
  "limits": {
    "timeout_seconds": 120,
    "network_policy": "unspecified"
  },
  "cache_state": "unspecified",
  "started_at": "2026-08-03T00:03:33.769480+00:00",
  "finished_at": "2026-08-03T00:03:33.769500+00:00",
  "status": "completed",
  "outputs": {
    "response": "[fake] Processed case 'conflicting-health-evidence-decision-path': A mid-market account shows: NPS of 72 (promoter), feature adoption at 91% of lic",
    "activation_evidence": "skill loaded from conditional-customer-success/SKILL.md",
    "artifact_digests": {},
    "tool_event_count": 8
  },
  "duration_ms": 0.007040973287075758,
  "token_usage": {
    "input_tokens": 100,
    "output_tokens": 50
  },
  "failures": [],
  "missing_evidence": []
}
