{
  "schema_version": 1,
  "trial_id": "2a492c09-2923-4c83-8c07-a39619bb3268",
  "candidate": {
    "skill_name": "conditional-customer-success",
    "skill_path": "conditional-customer-success",
    "tree_hash": "39ede540f58ad8d0"
  },
  "case": {
    "case_id": "public-service-accessibility-cs-routing",
    "prompt_hash": "95b39d799c80ac00",
    "fixture_hashes": {}
  },
  "adapter": {
    "name": "fake",
    "version": "0.1.0"
  },
  "harness": {
    "name": "fake",
    "version": "0.1.0"
  },
  "model": {
    "provider": "unspecified",
    "model_id": "unspecified"
  },
  "permissions": {},
  "network_policy": "unspecified",
  "limits": {
    "timeout_seconds": 120,
    "network_policy": "unspecified"
  },
  "cache_state": "unspecified",
  "started_at": "2026-08-03T00:03:33.741228+00:00",
  "finished_at": "2026-08-03T00:03:33.741248+00:00",
  "status": "completed",
  "outputs": {
    "response": "[fake] Processed case 'public-service-accessibility-cs-routing': We run a public-service portal for unemployment benefit applications. We have ci",
    "activation_evidence": "skill loaded from conditional-customer-success/SKILL.md",
    "artifact_digests": {},
    "tool_event_count": 7
  },
  "duration_ms": 0.0072499969974160194,
  "token_usage": {
    "input_tokens": 100,
    "output_tokens": 50
  },
  "failures": [],
  "missing_evidence": []
}
