{
  "schema_version": 1,
  "trial_id": "178f0700-6cf2-4a57-8427-222959e7e0a3",
  "candidate": {
    "skill_name": "implementation-planning",
    "skill_path": "implementation-planning",
    "tree_hash": "33603566b9f3a28b"
  },
  "case": {
    "case_id": "multi-team-ownership-conflict",
    "prompt_hash": "fd0cc2dc6769b0c2",
    "fixture_hashes": {}
  },
  "adapter": {
    "name": "fake",
    "version": "0.1.0"
  },
  "harness": {
    "name": "fake",
    "version": "0.1.0"
  },
  "model": {
    "provider": "unspecified",
    "model_id": "unspecified"
  },
  "permissions": {},
  "network_policy": "unspecified",
  "limits": {
    "timeout_seconds": 120,
    "network_policy": "unspecified"
  },
  "cache_state": "unspecified",
  "started_at": "2026-08-03T00:03:33.140109+00:00",
  "finished_at": "2026-08-03T00:03:33.140130+00:00",
  "status": "completed",
  "outputs": {
    "response": "[fake] Processed case 'multi-team-ownership-conflict': Approved spec for 'Real-Time Dashboard' requires: (a) streaming pipeline owned b",
    "activation_evidence": "skill loaded from implementation-planning/SKILL.md",
    "artifact_digests": {},
    "tool_event_count": 6
  },
  "duration_ms": 0.008207978680729866,
  "token_usage": {
    "input_tokens": 100,
    "output_tokens": 50
  },
  "failures": [],
  "missing_evidence": []
}
