{
  "schema_version": 1,
  "trial_id": "c43dc9fc-ab39-4b99-af4f-36a2d5ca246b",
  "candidate": {
    "skill_name": "capacity-and-cost-engineering",
    "skill_path": "capacity-and-cost-engineering",
    "tree_hash": "0fad0f317ad12846"
  },
  "case": {
    "case_id": "quota-decision",
    "prompt_hash": "a632038c1ce949b5",
    "fixture_hashes": {}
  },
  "adapter": {
    "name": "fake",
    "version": "0.1.0"
  },
  "harness": {
    "name": "fake",
    "version": "0.1.0"
  },
  "model": {
    "provider": "unspecified",
    "model_id": "unspecified"
  },
  "permissions": {},
  "network_policy": "unspecified",
  "limits": {
    "timeout_seconds": 120,
    "network_policy": "unspecified"
  },
  "cache_state": "unspecified",
  "started_at": "2026-08-03T00:03:34.499406+00:00",
  "finished_at": "2026-08-03T00:03:34.499427+00:00",
  "status": "completed",
  "outputs": {
    "response": "[fake] Processed case 'quota-decision': Our API gateway serves 10 external customers, each with a contracted rate limit.",
    "activation_evidence": "skill loaded from capacity-and-cost-engineering/SKILL.md",
    "artifact_digests": {},
    "tool_event_count": 9
  },
  "duration_ms": 0.009125040378421545,
  "token_usage": {
    "input_tokens": 100,
    "output_tokens": 50
  },
  "failures": [],
  "missing_evidence": []
}
