{
  "schema_version": 1,
  "trial_id": "aafa1f12-78e7-4d9f-a501-0bfb687d972c",
  "candidate": {
    "skill_name": "product-lifecycle",
    "skill_path": "product-lifecycle",
    "tree_hash": "b86016bfbbba6919"
  },
  "case": {
    "case_id": "cross-phase-evidence-handoff",
    "prompt_hash": "ffc3f22e8f4e3cea",
    "fixture_hashes": {}
  },
  "adapter": {
    "name": "fake",
    "version": "0.1.0"
  },
  "harness": {
    "name": "fake",
    "version": "0.1.0"
  },
  "model": {
    "provider": "unspecified",
    "model_id": "unspecified"
  },
  "permissions": {},
  "network_policy": "unspecified",
  "limits": {
    "timeout_seconds": 120,
    "network_policy": "unspecified"
  },
  "cache_state": "unspecified",
  "started_at": "2026-08-03T00:03:34.883442+00:00",
  "finished_at": "2026-08-03T00:03:34.883462+00:00",
  "status": "completed",
  "outputs": {
    "response": "[fake] Processed case 'cross-phase-evidence-handoff': A B2B SaaS product team completed discovery and strategy for a new integration m",
    "activation_evidence": "skill loaded from product-lifecycle/SKILL.md",
    "artifact_digests": {},
    "tool_event_count": 8
  },
  "duration_ms": 0.007874972652643919,
  "token_usage": {
    "input_tokens": 100,
    "output_tokens": 50
  },
  "failures": [],
  "missing_evidence": []
}
