{
  "schema_version": 1,
  "trial_id": "eed96a93-9f18-4123-9508-3ec192e4b0c2",
  "candidate": {
    "skill_name": "implementation-planning",
    "skill_path": "implementation-planning",
    "tree_hash": "33603566b9f3a28b"
  },
  "case": {
    "case_id": "risky-rollout-with-observability",
    "prompt_hash": "1ac875c3f5574bf4",
    "fixture_hashes": {}
  },
  "adapter": {
    "name": "fake",
    "version": "0.1.0"
  },
  "harness": {
    "name": "fake",
    "version": "0.1.0"
  },
  "model": {
    "provider": "unspecified",
    "model_id": "unspecified"
  },
  "permissions": {},
  "network_policy": "unspecified",
  "limits": {
    "timeout_seconds": 120,
    "network_policy": "unspecified"
  },
  "cache_state": "unspecified",
  "started_at": "2026-08-03T00:03:33.112929+00:00",
  "finished_at": "2026-08-03T00:03:33.112949+00:00",
  "status": "completed",
  "outputs": {
    "response": "[fake] Processed case 'risky-rollout-with-observability': Approved requirement: 'Replace the existing payment provider integration with Pr",
    "activation_evidence": "skill loaded from implementation-planning/SKILL.md",
    "artifact_digests": {},
    "tool_event_count": 6
  },
  "duration_ms": 0.007209018804132938,
  "token_usage": {
    "input_tokens": 100,
    "output_tokens": 50
  },
  "failures": [],
  "missing_evidence": []
}
