{
  "schema_version": 1,
  "trial_id": "ab5e0b48-2074-43cc-8059-91717daeda2a",
  "candidate": {
    "skill_name": "production-excellence",
    "skill_path": "production-excellence",
    "tree_hash": "b86016bfbbba6919"
  },
  "case": {
    "case_id": "normal-release-safe-launch",
    "prompt_hash": "6e8d98f6c803a45d",
    "fixture_hashes": {}
  },
  "adapter": {
    "name": "fake",
    "version": "0.1.0"
  },
  "harness": {
    "name": "fake",
    "version": "0.1.0"
  },
  "model": {
    "provider": "unspecified",
    "model_id": "unspecified"
  },
  "permissions": {},
  "network_policy": "unspecified",
  "limits": {
    "timeout_seconds": 120,
    "network_policy": "unspecified"
  },
  "cache_state": "unspecified",
  "started_at": "2026-08-03T00:03:34.945288+00:00",
  "finished_at": "2026-08-03T00:03:34.945443+00:00",
  "status": "completed",
  "outputs": {
    "response": "[fake] Processed case 'normal-release-safe-launch': We are launching a new user-facing API service to production. The readiness revi",
    "activation_evidence": "skill loaded from production-excellence/SKILL.md",
    "artifact_digests": {},
    "tool_event_count": 7
  },
  "duration_ms": 0.011625001206994057,
  "token_usage": {
    "input_tokens": 100,
    "output_tokens": 50
  },
  "failures": [],
  "missing_evidence": []
}
