{
  "schema_version": 1,
  "trial_id": "94105710-0ecb-4a76-9166-71185923b518",
  "candidate": {
    "skill_name": "conditional-customer-success",
    "skill_path": "conditional-customer-success",
    "tree_hash": "39ede540f58ad8d0"
  },
  "case": {
    "case_id": "renewal-risk-with-mixed-signals",
    "prompt_hash": "9dc9d68573ef23a2",
    "fixture_hashes": {}
  },
  "adapter": {
    "name": "fake",
    "version": "0.1.0"
  },
  "harness": {
    "name": "fake",
    "version": "0.1.0"
  },
  "model": {
    "provider": "unspecified",
    "model_id": "unspecified"
  },
  "permissions": {},
  "network_policy": "unspecified",
  "limits": {
    "timeout_seconds": 120,
    "network_policy": "unspecified"
  },
  "cache_state": "unspecified",
  "started_at": "2026-08-03T00:03:33.755455+00:00",
  "finished_at": "2026-08-03T00:03:33.755478+00:00",
  "status": "completed",
  "outputs": {
    "response": "[fake] Processed case 'renewal-risk-with-mixed-signals': We have an enterprise account up for renewal in 60 days. The account shows: prod",
    "activation_evidence": "skill loaded from conditional-customer-success/SKILL.md",
    "artifact_digests": {},
    "tool_event_count": 8
  },
  "duration_ms": 0.00929197994992137,
  "token_usage": {
    "input_tokens": 100,
    "output_tokens": 50
  },
  "failures": [],
  "missing_evidence": []
}
